{
  "$schema": "https://json-schema.org/draft/2020-12/schema",
  "$id": "mission/dag/schema/scenario_dag.schema.v1.json",
  "title": "Mission Scenario DAG v1",
  "type": "object",
  "additionalProperties": false,
  "required": [
    "scenario_id",
    "scenario_version",
    "mode",
    "seed",
    "modules",
    "outputs"
  ],
  "properties": {
    "scenario_id": {
      "type": "string",
      "minLength": 1
    },
    "scenario_version": {
      "type": "string",
      "const": "v1"
    },
    "mode": {
      "type": "string",
      "enum": [
        "realistic",
        "speculative",
        "dual"
      ]
    },
    "seed": {
      "type": "integer"
    },
    "modules": {
      "type": "array",
      "minItems": 1,
      "items": {
        "type": "object",
        "additionalProperties": false,
        "required": [
          "node_id",
          "module_id",
          "depends_on"
        ],
        "properties": {
          "node_id": {
            "type": "string",
            "minLength": 1
          },
          "module_id": {
            "type": "string",
            "minLength": 1
          },
          "depends_on": {
            "type": "array",
            "items": {
              "type": "string",
              "minLength": 1
            }
          }
        }
      }
    },
    "outputs": {
      "type": "object",
      "additionalProperties": false,
      "required": [
        "final_metrics"
      ],
      "properties": {
        "final_metrics": {
          "type": "array",
          "minItems": 1,
          "items": {
            "type": "string",
            "minLength": 1
          }
        }
      }
    }
  }
}
